{
  "protocol": "crdd-ir/unreal-execution-v0.1",
  "operation": "PlaceWall",
  "reportCreatedOn": "2026.07.28-10.48.40",
  "sourceReportSha256": "8ceb8d937c2d6fe9a6ea2f2064526f6b1a8bff52bd1e75751a2c689311653997",
  "platforms": [
    "WindowsEditor"
  ],
  "summary": {
    "succeeded": 3,
    "failed": 0,
    "notRun": 0
  },
  "tests": [
    {
      "path": "CRDD.Assets.WallPreview",
      "state": "Success",
      "durationSeconds": 0.016815800219774246,
      "warnings": 0,
      "errors": 0
    },
    {
      "path": "CRDD.Assets.WallPreviewLevel",
      "state": "Success",
      "durationSeconds": 0.21142469346523285,
      "warnings": 0,
      "errors": 0
    },
    {
      "path": "CRDD.PlaceWall.Conformance",
      "state": "Success",
      "durationSeconds": 0.01225300133228302,
      "warnings": 0,
      "errors": 0
    }
  ]
}
