{
  "protocol": "crdd-ir/unreal-execution-v0.1",
  "operation": "CreateEntity",
  "reportCreatedOn": "2026.07.29-04.59.38",
  "sourceReportSha256": "ac61b048a05cea6cd14da2d12948605898d2f18c5949aec3cf7d3af30beabf11",
  "platforms": [
    "WindowsEditor"
  ],
  "summary": {
    "succeeded": 9,
    "failed": 0,
    "notRun": 0
  },
  "tests": [
    {
      "path": "CRDD.Assets.GeneratedMeshes",
      "state": "Success",
      "durationSeconds": 0.02428489923477173,
      "warnings": 0,
      "errors": 0
    },
    {
      "path": "CRDD.Assets.GeneratedPreviewLevels",
      "state": "Success",
      "durationSeconds": 0.40289050340652466,
      "warnings": 0,
      "errors": 0
    },
    {
      "path": "CRDD.Assets.GeneratedScene",
      "state": "Success",
      "durationSeconds": 0.16049489378929138,
      "warnings": 0,
      "errors": 0
    },
    {
      "path": "CRDD.CreateEntity.Bridge.AtomicFailure.Generated",
      "state": "Success",
      "durationSeconds": 0.016538597643375397,
      "warnings": 0,
      "errors": 0
    },
    {
      "path": "CRDD.CreateEntity.Conformance",
      "state": "Success",
      "durationSeconds": 0.016366899013519287,
      "warnings": 0,
      "errors": 0
    },
    {
      "path": "CRDD.CreateWall.Bridge.AtomicFailure.Generated",
      "state": "Success",
      "durationSeconds": 0.01655140146613121,
      "warnings": 0,
      "errors": 0
    },
    {
      "path": "CRDD.CreateWall.NumericBoundary.Generated",
      "state": "Success",
      "durationSeconds": 0.01665080338716507,
      "warnings": 0,
      "errors": 0
    },
    {
      "path": "CRDD.Integration.GeneratedAssets",
      "state": "Success",
      "durationSeconds": 0.1515548974275589,
      "warnings": 0,
      "errors": 0
    },
    {
      "path": "CRDD.UpdateEntity.Bridge.AtomicFailure.Generated",
      "state": "Success",
      "durationSeconds": 0.011306099593639374,
      "warnings": 0,
      "errors": 0
    }
  ]
}
